{
  "schemaId": "agent.semantic-protocols.hook.provider-manifest",
  "schemaVersion": "1",
  "protocolId": "agent.semantic-protocols.hook",
  "protocolVersion": "1",
  "manifestId": "agent.semantic-protocols.providers.objective-c.ccls-asp",
  "manifestVersion": "v1",
  "languageId": "objective-c",
  "providerId": "ccls-asp",
  "namespace": "agent.semantic-protocols.languages.objective-c.ccls-asp",
  "binary": "ccls-asp",
  "commandPrefixArgs": ["--language", "objective-c"],
  "execution": "external-process",
  "source": {
    "defaultExtensions": [".m", ".mm", ".h"],
    "defaultConfigFiles": ["compile_commands.json", ".ccls", "CMakeLists.txt", "project.pbxproj"],
    "defaultSourceRoots": ["src", "Sources", "include", "tests"],
    "defaultIgnoredPathPrefixes": ["build", "DerivedData"],
    "defaultProjectMarkers": ["compile_commands.json", ".ccls", "CMakeLists.txt", "project.pbxproj"],
    "defaultDependencyMarkers": ["compile_commands.json", "CMakeLists.txt", "project.pbxproj"]
  },
  "searchCapabilities": {
    "semanticFacts": true,
    "dependencyTopology": false,
    "dependencyTopologyMetadata": false
  },
  "policy": {
    "directSourceRead": "block",
    "bulkSourceDump": "block",
    "rawSourceSearch": "block",
    "agentSearchJson": "block"
  },
  "routes": {
    "query": {"argv": ["ccls-asp", "--language", "objective-c", "query", "--selector", "{selector}", "--workspace", "{projectRoot}", "--code"]},
    "ingest": {"argv": ["ccls-asp", "--language", "objective-c", "search", "ingest", "--workspace", "{projectRoot}"], "stdinMode": "pipe-candidates"},
    "guide": {"argv": ["ccls-asp", "--language", "objective-c", "guide", "--workspace", "{projectRoot}"]}
  }
}
